{
  "schema_version": "2.0",
  "kind": "flowchart",
  "title": "文档发布流程",
  "language": "zh",
  "nodes": [
    {"id": "start", "type": "terminal", "label": "内容完成"},
    {"id": "review", "type": "decision", "label": "质量检查通过？"},
    {"id": "publish", "type": "data", "label": "生成 PDF"},
    {"id": "revise", "type": "step", "label": "修改内容"},
    {"id": "end", "type": "terminal", "label": "发布完成"}
  ],
  "edges": [
    {"source": "start", "target": "review"},
    {"source": "review", "target": "publish", "kind": "conditional-flow", "label": "通过"},
    {"source": "review", "target": "revise", "kind": "conditional-flow", "label": "退回"},
    {"source": "publish", "target": "end"},
    {"source": "revise", "target": "end"}
  ]
}
